,citation_author,citation_author_institution,citation_publication_date,citation_title,dc.description,dc.publisher,dc.subject,dc.type,url,accesses,citations
0,Chad Turner/Robert Tamura/Sean E. Mulholland/Scott Baier,"Nicholls State University, Thibodaux, USA/Clemson University, Clemson, USA/Atlanta Federal Reserve Bank, Atlanta, USA/Mercer College, Macon, USA/Clemson University, Clemson, USA/Atlanta Federal Reserve Bank, Atlanta, USA",2007/06,Education and income of the states of the United States: 1840–2000,"This article introduces original annual average years of schooling measures for each state from 1840 to 2000. Our methodology results in state estimates similar to those reported in the United States Census from 2000 back to 1940 and national, turn of the century estimates strikingly close to those presented by Schultz (Schultz, T. (1961). In N. B. Henry (Ed.), Social forces influencing American education. Chicago: University of Chicago Press.) and Fishlow (Fishlow, A. (1966). In H. Rosovsky (Ed.), Industrialization in two systems. John Wiley &amp; Sons). To further determine the validity of our state schooling estimates, we first combine original data on real state per worker output with existing data to provide a more comprehensive series of real state output per worker from 1840 to 2000. We then estimate aggregate Mincerian earnings regressions and discover that the return to a year of schooling for the average individual in a state ranges from 11% to 15%. This range is robust to various time periods, various estimation methods, various assumptions about the endogeneity of schooling and is in line with the body of evidence from the labor literature.",Springer,Economic Growth/Macroeconomics/Monetary Economics//Financial Economics/International Economics,OriginalPaper,https://link.springer.com//article/10.1007/s10887-007-9016-0,    586 ,   49 
0,Edward L. Glaeser/Giacomo A. M. Ponzetto/Andrei Shleifer,"Harvard University and NBER, Cambridge, USA/Department of Economics, Harvard University, Cambridge, USA/Harvard University and NBER, Cambridge, USA/Department of Economics, Harvard University, Cambridge, USA",2007/06,Why does democracy need education?,"Across countries, education and democracy are highly correlated. We motivate empirically and then model a causal mechanism explaining this correlation. In our model, schooling teaches people to interact with others and raises the benefits of civic participation, including voting and organizing. In the battle between democracy and dictatorship, democracy has a wide potential base of support but offers weak incentives to its defenders. Dictatorship provides stronger incentives to a narrower base. As education raises the benefits of civic engagement, it raises participation in support of a broad-based regime (democracy) relative to that in support of a narrow-based regime (dictatorship). This increases the likelihood of successful democratic revolutions against dictatorships, and reduces that of successful anti-democratic coups.",Springer,Economic Growth/Macroeconomics/Monetary Economics//Financial Economics/International Economics,OriginalPaper,https://link.springer.com//article/10.1007/s10887-007-9015-1,    3880 ,   243 
0,Kieran McQuinn/Karl Whelan,"Central Bank and Financial Services Authority of Ireland, Dublin, Ireland/Central Bank and Financial Services Authority of Ireland, Dublin, Ireland",2007/06,Conditional convergence and the dynamics of the capital-output ratio,"Output per worker can be expressed as a function of technological efficiency and of the capital-output ratio. Because technology is exogenous in the Solow model, all of the endogenous convergence dynamics take place through the adjustment of the capital-output ratio. This paper uses the empirical behavior of the capital-output ratio to estimate the speed of conditional convergence of economies towards their steady-state paths. We find that the conditional convergence speed is about seven percent per year. This is somewhat faster than predicted by the Solow model and is significantly higher than reported in most previous studies based on output per worker regressions. We show that, once there are stochastic shocks to technology, standard panel econometric techniques produce downward-biased estimates of convergence speeds, while our approach does not.",Springer,Economic Growth/Macroeconomics/Monetary Economics//Financial Economics/International Economics,OriginalPaper,https://link.springer.com//article/10.1007/s10887-007-9013-3,    426 ,   20 
0,Nicola Gennaioli/Ilia Rainer,"Institute of International Economic Studies, Stockholm University, Stockholm, Sweden/George Mason University, Fairfax, USA",2007/09,The modern impact of precolonial centralization in Africa,"We empirically assess the possibility, stressed by African scholars, that stronger precolonial political institutions allowed colonial and postcolonial African governments to better implement modernization programs in rural areas. Using anthropological data, we document a strong positive association between the provision of public goods such as education, health, and infrastructure in African countries and the centralization of their ethnic groups’ precolonial institutions. We develop an empirical test to distinguish among alternative explanations for this finding. The evidence supports the view that precolonial centralization improved public goods provision by increasing the accountability of local chiefs. Our results stress the importance for developing countries to create mechanisms to monitor local administrators of public projects. These mechanisms should be consistent with these countries’ preexisting and informal arrangements.",Springer,Economic Growth/Macroeconomics/Monetary Economics//Financial Economics/International Economics,OriginalPaper,https://link.springer.com//article/10.1007/s10887-007-9017-z,    2030 ,   181 
0,John Hassler/José V. Rodríguez Mora/Joseph Zeira,"Institute for International Economics Studies (IIES), Stockholm University, Stockholm, Sweden/Centre for Economic Policy Research, London, UK/Centre for Economic Policy Research, London, UK/University of Southampton, Southampton, UK/Universitat Pompeu Fabra, Barcelona, Spain/University of Edinburgh, Edinburgh, UK/Centre for Economic Policy Research, London, UK/Hebrew University of Jerusalem, Jerusalem, Israel",2007/09,Inequality and mobility,"Acknowledging that wage inequality and intergenerational mobility are strongly interrelated, this paper presents a model in which both are jointly determined. The model enables us to study how inequality and mobility are affected by exogenous changes and what determines their correlation. A main implication of the model is that differences in the amount of public subsidies to education and educational quality produce cross-country patterns with a negative correlation between inequality and mobility. Differences in the labor market, like differences in skill-biased technology or wage compression instead produce a positive correlation. The predictions of the model are found to be consistent with various empirical observations on mobility and inequality.",Springer,Economic Growth/Macroeconomics/Monetary Economics//Financial Economics/International Economics,OriginalPaper,https://link.springer.com//article/10.1007/s10887-007-9019-x,    799 ,   26 
0,Joshua Aizenman/Ilan Noy,"Economics Department and the NBER, UC Santa Cruz, Santa Cruz, USA/Economics Department, University of Hawaii, Honolulu, USA",2007/09,"Prizes for basic research: Human capital, economic might and the shadow of history","We study the distribution of basic scientific research across countries and time, and explain the process that resulted in the United States becoming the undisputed leader in basic research. Our study is based on the records of scientific awards, and on the data of global economic trends. We investigate the degree to which scale/threshold effects account for the number of prizes won. We constructed a stylized model, predicting a non-linear relationship with lagged relative GDP as an important explanatory variable of a country’s share of prizes. Our empirical research findings find support for these predictions and the presence of a “winner-takes-all” effect.",Springer,Economic Growth/Macroeconomics/Monetary Economics//Financial Economics/International Economics,OriginalPaper,https://link.springer.com//article/10.1007/s10887-007-9018-y,    187 ,   5 
0,Alwyn Young,"London School of Economics, London, UK",2007/12,In sorrow to bring forth children: fertility amidst the plague of HIV,"The HIV epidemic is lowering fertility in sub-Saharan Africa. This decline in fertility appears to reflect a fall in the demand for children, and not any adverse physiological consequences of the disease, as it is matched by changes in the expressed preference for children and the use of contraception, and is not significantly correlated with biological markers of sub-fecundity. A fall in fertility lowers dependency ratios and, for a given savings rate, increases future capital per person. These two effects more than offset the loss of prime working age adults and reduced human capital of orphaned children brought by the epidemic, allowing 27 of the nations of sub-Saharan Africa to cumulatively spend US$ 650 billion, or $5100 per dying adult AIDS victim, on patient care without harming the welfare of future generations. In sum, the behavioral response to the HIV epidemic creates the material resources to fight it.",Springer,Economic Growth/Macroeconomics/Monetary Economics//Financial Economics/International Economics,OriginalPaper,https://link.springer.com//article/10.1007/s10887-007-9021-3,    282 ,   35 
0,Pietro F. Peretto/Michelle Connolly,"Department of Economics, Duke University, Durham, USA/Department of Economics, Duke University, Durham, USA",2007/12,The Manhattan Metaphor,"Fixed operating costs draw a sharp distinction between endogenous growth based on horizontal and vertical innovation: a larger number of product lines puts pressure on an economy’s resources; greater productivity of existing product lines does not. Consequently, the only plausible engine of endogenous growth is vertical innovation whereby progress along the quality or cost ladder does not require the replication of fixed costs. Is, then, product variety expansion irrelevant? No. The two dimensions of technology are complementary in that using one and the other produces a more comprehensive theory of economic growth. The vertical dimension allows endogenous growth unconstrained by endowments, the horizontal provides the mechanism that translates changes in aggregate variables into changes in product-level variables, which ultimately drive incentives to push the technological frontier in the vertical dimension. We show that the potential for exponential growth due to an externality that makes entry costs fall linearly with the number of products, combined with the limited carrying capacity of the system due to fixed operating costs, yields logistic dynamics for the number of products. This desirable property allows us to provide a closed-form solution for the model’s transition path and thereby derive analytically the welfare effects of changes in parameters and policy variables. Our Manhattan Metaphor illustrates conceptually why we obtain this mathematical representation when we simply add fixed operating costs to the standard modeling of variety expansion.",Springer,Economic Growth/Macroeconomics/Monetary Economics//Financial Economics/International Economics,OriginalPaper,https://link.springer.com//article/10.1007/s10887-007-9023-1,    330 ,   56 
0,Javier A. Birchenall,"Department of Economics, 2127 North Hall University of California at Santa Barbara, Santa Barbara, USA",2007/12,Escaping high mortality,"This paper develops an economic analysis of mortality to account for the mortality decline during the demographic transition. We propose a unified growth model in which there is intra- and intergenerational health transmission: parental health affects child survival and investments in early life improve health over the entire life-cycle. Based on data from England and Wales between 1640 and 2000, we show that the role of economic changes in mortality is larger than previously estimated. As in current estimates, contemporary income has a minor impact on mortality change. Most of the economic influences, however, are unaccounted for by contemporary relationships.",Springer,Economic Growth/Macroeconomics/Monetary Economics//Financial Economics/International Economics,OriginalPaper,https://link.springer.com//article/10.1007/s10887-007-9022-2,    209 ,   12 
0,Jakob B. Madsen,"Department of Economics, Monash University, Caulfield East, Australia/EPRU and FRU, Department of Economics, University of Copenhagen, Copenhagen K, Denmark",2008/03,Semi-endogenous versus Schumpeterian growth models: testing the knowledge production function using international data,"Using various indicators of innovative activity and product variety in the OECD countries over the past century, this paper tests first- and second-generation models of economic growth. The estimation results give evidence in favour of Schumpeterian models, while the semi-endogenous growth theories are shown not to be consistent with the data.",Springer,Economic Growth/Macroeconomics/Monetary Economics//Financial Economics/International Economics,OriginalPaper,https://link.springer.com//article/10.1007/s10887-007-9024-0,    981 ,   140 
0,David de la Croix/Davide Dottori,"Department of Economics &amp; CORE, Université catholique de Louvain, Louvain-la-Neuve, Belgium/Department of Economics, Université catholique de Louvain, Louvain-la-Neuve, Belgium/Department of Economics, Polytechnic University of Marche, Ancona, Italy",2008/03,Easter Island’s collapse: a tale of a population race,"The Easter Island tragedy has become an allegory for ecological catastrophe and a warning for the future. In the economic literature the collapse is usually attributed to irrational or myopic behavior in the context of a fragile ecosystem. In this paper we propose an alternative story involving non-cooperative bargaining between clans to share the crop. Each clan’s bargaining power depends on its threat level when fighting a war. The biggest group has the highest probability of winning. A clan’s fertility is determined ex ante by each group. In the quest for greater bargaining power, each clan’s optimal size depends on that of the other clan, and a population race follows. This race may exhaust the natural resources and lead to the ultimate collapse of the society. In addition to well-known natural factors, the likelihood of a collapse turns out to be greater when the cost of war is low, the probability of succeeding in war is highly responsive to the number of fighters, and the marginal return to labor is high. We analyze whether these factors can account for the difference between Easter and Tikopia Islands. The paper also makes a methodological contribution in that it is the first fertility model to include strategic complementarities between groups’ fertility decisions.",Springer,Economic Growth/Macroeconomics/Monetary Economics//Financial Economics/International Economics,OriginalPaper,https://link.springer.com//article/10.1007/s10887-007-9025-z,    517 ,   23 
0,Cecilia García-Peñalosa/Jean-François Wen,"CNRS and GREQAM, Marseille, France/University of Calgary, Calgary, Canada",2008/03,Redistribution and entrepreneurship with Schumpeterian growth,"We examine the effects of redistributive taxation on growth and inequality in a Schumpeterian model with risk-averse agents. There are skilled and unskilled workers, and the growth rate is determined by the occupational choice of skilled agents between entrepreneurship and employment. We show that redistribution provides insurance to entrepreneurs and increases the growth rate. The effects on inequality are such that low tax rates increase inequality relative to laissez-faire due to changes in wages, but higher tax rates can simultaneously raise growth and reduce inequality. We contrast the optimal linear income tax with alternative policies for promoting R&amp;D and find that it is preferable on both equity and efficiency grounds.",Springer,Economic Growth/Macroeconomics/Monetary Economics//Financial Economics/International Economics,OriginalPaper,https://link.springer.com//article/10.1007/s10887-008-9027-5,    417 ,   18 
0,Peter Lorentzen/John McMillan/Romain Wacziarg,"Department of Political Science, University of California, Berkeley, USA/Graduate School of Business, Stanford University, Stanford, USA/CEPR, London, UK/Graduate School of Business, Stanford University, Stanford, USA/CEPR, London, UK/NBER, Cambridge, USA",2008/06,Death and development,"Analyzing a variety of cross-national and sub-national data, we argue that high adult mortality reduces economic growth by shortening time horizons. Paying careful attention to the age pattern of mortality and to endogeneity issues, we find that a greater risk of death during the prime productive years is associated with higher levels of risky behavior, higher fertility, and lower investment in physical capital, even when controlling for infant mortality. In our regressions, adult mortality explains almost all of Africa’s growth tragedy. This analysis underscores grim forecasts of the long-run economic costs of the ongoing AIDS epidemic.",Springer,Economic Growth/Macroeconomics/Monetary Economics//Financial Economics/International Economics,OriginalPaper,https://link.springer.com//article/10.1007/s10887-008-9029-3,    1401 ,   174 
0,Shekhar Aiyar/Carl-Johan Dalgaard/Omer Moav,"International Monetary Fund, Washington, USA/University of Copenhagen, Copenhagen, Denmark/Hebrew University, Jerusalam, Isreal/Royal Holloway University of London, Egham, UK/Shalem Center, Jerusalam, Isreal/CEPR, London, UK",2008/06,Technological progress and regress in pre-industrial times,"This paper offers micro-foundations for the dynamic relationship between technology and population in the pre-industrial world, accounting for both technological progress and the hitherto neglected but common phenomenon of technological regress. A positive feedback between population and the adoption of new techniques that increase the division of labor explains technological progress. A transient shock to productivity or population induces the neglect of some techniques rendered temporarily unprofitable, which are therefore not transmitted to the next generation. Productivity remains constrained by the smaller stock of knowledge and technology has thereby regressed. A slow process of rediscovery is required for the economy to reach its previous level of technological sophistication and population size. The model is employed to analyze specific historical examples of technological regress. 
                   Inventions don’t just get adopted once and forever; they have to be constantly practised and transmitted, or useful techniques may be forgotten. 
                  Jared Diamond, , 1993.
                
                     ",Springer,Economic Growth/Macroeconomics/Monetary Economics//Financial Economics/International Economics,OriginalPaper,https://link.springer.com//article/10.1007/s10887-008-9030-x,    1181 ,   31 
0,Levon Barseghyan,"Cornell University, Ithaca, USA",2008/06,Entry costs and cross-country differences in productivity and output,"This paper contributes to the literature on cross-country income differences by studying the effect of entry barriers on productivity and output. Using instrumental variable regressions I show that higher entry costs significantly reduce output per worker and that they do so by lowering total factor productivity. In particular, an increase in entry costs by 80% of income per capita, which is one half of their standard deviation in my sample, is estimated to decrease total factor productivity and output per worker by 22% and 29%, respectively.",Springer,Economic Growth/Macroeconomics/Monetary Economics//Financial Economics/International Economics,OriginalPaper,https://link.springer.com//article/10.1007/s10887-008-9026-6,    591 ,   71 
0,Holger Strulik/Jacob Weisdorf,"Wirtschaftswissenschaftliche Fakultät, University of Hannover, Hannover, Germany/Department of Economics, University of Copenhagen, Copenhagen K, Denmark",2008/09,"Population, food, and knowledge: a simple unified growth theory","This paper provides a unified growth theory, i.e. a model that explains the very long-run economic and demographic development path of industrialized economies, stretching from the pre-industrial era to the present-day and beyond. Making strict use of Malthus’ (An essay on the principle of population. London, printed for J. Johnson, 1798) so-called preventive check hypothesis—that fertility rates vary inversely with the price of food—the current study offers a new and straightforward explanation for the demographic transition and the break with the Malthusian era. Employing a two-sector framework with agriculture and industry, we demonstrate how fertility responds differently to productivity and income growth, depending on whether it emerges in agriculture or industry. Agricultural productivity and income growth makes food goods, and therefore children, relatively less expensive. Industrial productivity and income growth, on the other hand, makes food goods, and therefore children, relatively more expensive. The present framework lends support to existing unified growth theories and is well in tune with historical evidence about structural transformation.",Springer,Economic Growth/Macroeconomics/Monetary Economics//Financial Economics/International Economics,OriginalPaper,https://link.springer.com//article/10.1007/s10887-008-9033-7,    1155 ,   90 
0,Simeon Djankov/Jose G. Montalvo/Marta Reynal-Querol,"The World Bank, Washington, USA/CEPR, London, UK/Department of Economics, Universitat Pompeu Fabra, Barcelona GSE, Barcelona, Spain/IVIE, Valencia, Spain/Department of Economics, Universitat Pompeu Fabra, Barcelona GSE, Barcelona, Spain/CEPR, London, UK/CESifo, Munich, Germany",2008/09,The curse of aid,"Foreign aid provides a windfall of resources to recipient countries and may result in the same rent seeking behavior as documented in the “curse of natural resources” literature. In this paper we discuss this effect and document its magnitude. Using panel data for 108 recipient countries in the period 1960–1999, we find that foreign aid has a negative impact on institutions. In particular, if the foreign aid over GDP that a country receives over a period of 5 years reaches the 75th percentile in the sample, then a 10-point index of democracy is reduced between 0.5 and almost one point, a large effect. For comparison, we also measure the effect of oil rents on political institutions. We find that aid is a bigger curse than oil.",Springer,Economic Growth/Macroeconomics/Monetary Economics//Financial Economics/International Economics,OriginalPaper,https://link.springer.com//article/10.1007/s10887-008-9032-8,    3695 ,   270 
0,Joerg Baten/Jan Luiten van Zanden,"Department of Economics, and CESifo, University of Tuebingen, Tuebingen, Germany/Utrecht University and Internation Institute Social History, Amsterdam, The Netherlands",2008/09,Book production and the onset of modern economic growth,"We provide a new data set on per capita book production as a proxy for advanced literacy skills, and assess this relative to other measures. While literacy proxies very basic skills, book production per capita is an indicator for more advanced capabilities. Growth theory suggests that human capital formation plays a significant role in creating the ‘wealth of nations.’ This study tests whether human capital formation has an impact on early-modern growth disparities. In contrast to some previous studies which denied the role of human capital as a crucial determinant of long-term growth, we confirm its importance.",Springer,Economic Growth/Macroeconomics/Monetary Economics//Financial Economics/International Economics,OriginalPaper,https://link.springer.com//article/10.1007/s10887-008-9031-9,    1111 ,   78 
