,citation_author,citation_author_institution,citation_publication_date,citation_title,dc.description,dc.publisher,dc.subject,dc.type,url,accesses,citations
0,Robert J. Barro,"Department of Economics, Harvard University, Cambridge, USA",1996/03,Democracy and growth,"Growth and democracy (subjective indexes of political freedom) are analyzed for a panel of about 100 countries from 1960 to 1990. The favorable effects on growth include maintenance of the rule of law, free markets, small government consumption, and high human capital. Once these kinds of variables and the initial level of real per capita GDP are held constant, the overall effect of democracy on growth is weakly negative. There is a suggestion of a nonlinear relationship in which more democracy enhances growth at low levels of political freedom but depresses growth when a moderate level of freedom has already been attained. Improvements in the standard of living—measured by GDP, health status, and education—substantially raise the probability that political freedoms will grow. These results allow for predictions about which countries will become more or less democratic over time.",Springer,Economic Growth/Macroeconomics/Monetary Economics//Financial Economics/International Economics,OriginalPaper,https://link.springer.com//article/10.1007/BF00163340,    6180 ,   659 
0,Jacob Mincer,"Economics Department, Columbia University, New York, USA/National Bureau of Economic Resesarch, USA",1996/03,"Economic development, growth of human capital, and the dynamics of the wage structure","In this paper I elucidate the sources of growth of human capital in the course of economic development. On the supply side (Section 1) I include the growth of family income, urbanization, the demographic transition, and the rising cost of time.The supply side alone cannot explain the continuous growth of human capital as it implies a self limiting decline in rates of return below those in alternative investments. Such declines are offset by growing demands for human capital in the labor market. Growth of demand for labor skills is a function of capital accumulation and of technological changes. Evidence on this hypothesis is summarized in Section 2 and on supply responses to growing demand for human capital in Section 3. Changes in the skill and wage structures in the labor market are an important part of the evidence.The reciprocal relation between economic growth and the growth of human capital is likely to be an important key to sustained economic growth. A caveat applies to indirect effects of economic growth on family instability, which may lead to a deterioration of childhood human capital in some sectors of society.",Springer,Economic Growth/Macroeconomics/Monetary Economics//Financial Economics/International Economics,OriginalPaper,https://link.springer.com//article/10.1007/BF00163341,    702 ,   37 
0,Philippe Aghion/Peter Howitt,"Department of Economics, Nuffield College, Oxford, United Kingdom/EBRD, London, United Kingdom/Department of Economics, University of Western Ontario, London, Canada/C.I.A.R., and IDEI, Toulouse, France",1996/03,Research and development in the growth process,"This paper introduces into Schumpeterian growth theory an important element of heterogeneity in the structure of innovative activity—namely, the distinction between research and development. We construct a simple model of growth to investigate how the (steady-state) rate of growth affects and is affected by the relative mix between research and development. Although we assume for simplicity that the total supply of innovative activity is given it turns out that, with one important exception, the growth rate responds to most parameter changes in the same way as in previous models where growth was determined by the total amount of innovative activity. In particular, the level of research tends to covary positively with the rate of growth, even in the extreme case where the general knowledge that underlies long-run growth is created only by secondary innovations arising from the development process. The exception concerns the effects of competition on growth. Although simpler Schumpeterian growth models implied that increased competition would reduce growth by reducing the incentive to innovate, introducing the distinction between research and development implies that this effect is likely to be reversed.",Springer,Economic Growth/Macroeconomics/Monetary Economics//Financial Economics/International Economics,OriginalPaper,https://link.springer.com//article/10.1007/BF00163342,    618 ,   80 
0,Steven N. Durlauf,"Department of Economics, University of Wisconsin, Madison, USA/National Bureau of Economic Research, USA",1996/03,A theory of persistent income inequality,"This paper explores the dynamics of income inequality by studying the evolution of human capital investment and neighborhood choice for a population of families. Parents affect the conditional probability distribution of their children's income through the choice of a neighborhood in which to live. Neighborhood location affects children both through local public finance of education as well as through sociological effects. These forces combine to create incentives for wealthier families to segregate themselves into economically homogeneous neighborhoods. Economic stratification combines with strong neighborhoodwide feedback effects to transmit economic status across generations, leading to persistent income inequality.",Springer,Economic Growth/Macroeconomics/Monetary Economics//Financial Economics/International Economics,OriginalPaper,https://link.springer.com//article/10.1007/BF00163343,    1982 ,   295 
0,Danny T. Quah,"Economics Department, London School of Economics, London, United Kingdom",1996/03,Convergence empirics across economies with (some) capital mobility,"This paper uses a model of growth and imperfect capital mobility across multiple economies to characterize the dynamics of (cross-country) income distributions. This allows convenient study of the convergence hypothesis, and reveals, where appropriate, polarization and clumping within subgroups. The data show little cross-country convergence; instead, the important features are persistence, immobility, and polarization, exemplified by “convergence club” or “twin peaks” dynamics.",Springer,Economic Growth/Macroeconomics/Monetary Economics//Financial Economics/International Economics,OriginalPaper,https://link.springer.com//article/10.1007/BF00163344,    516 ,   217 
0,Jess Benhabib/Aldo Rustichini,"Department of Economics, New York University, New York, USA/CORE, Universite Catholique de Louvain, Louvain La Neuve, Belgium",1996/03,Social conflict and growth,"Despite the predictions of the neoclassical theory of economic growth, we observe that poor countries have invested at lower rates and have not grown faster than rich countries. To explain these empirical regularities we provide a game-theoretic model of conflict between social groups over the distribution of income. Among all possible equilibria, we concentrate on those that are on the constrained Pareto frontier. We study how the level of wealth and the degree of inequality affects growth. We show how lower wealth can lead to lower growth and even to stagnation when the incentives to domestic accumulation are weakened by redistributive considerations.",Springer,Economic Growth/Macroeconomics/Monetary Economics//Financial Economics/International Economics,OriginalPaper,https://link.springer.com//article/10.1007/BF00163345,    1121 ,   182 
0,Robert J. Barro,"Department of Economics, Harvard University, Cambridge, USA",1996/06,"Institutions and growth, an introductory essay",,Springer,Economic Growth/Macroeconomics/Monetary Economics//Financial Economics/International Economics,OriginalPaper,https://link.springer.com//article/10.1007/BF00138860,    379 ,   13 
0,Roberto Perotti,"Department of Economics, Columbia University, New York, USA",1996/06,"Growth, income distribution, and democracy: What the data say","This paper investigates the relationship between income distribution, democratic institutions, and growth. It does so by addressing three main issues: the properties and reliability of the income distribution data, the robustness of the reduced form relationships between income distribution and growth estimated so far, and the specific channels through which income distribution affects growth. The main conclusion in this regard is that there is strong empirical support for two types of explanations, linking income distribution to sociopolitical instability and to the education/fertility decision. A third channel, based on the interplay of borrowing constraints and investment in human capital, also seems to receive some support by the data, although it is probably the hardest to test with the existing data. By contrast, there appears to be less empirical support for explanations based on the effects of income distribution on fiscal policy.",Springer,Economic Growth/Macroeconomics/Monetary Economics//Financial Economics/International Economics,OriginalPaper,https://link.springer.com//article/10.1007/BF00138861,    4900 ,   777 
0,Alberto Alesina/Sule Özler/Nouriel Roubini/Phillip Swagel,"Department of Economic, Harvard University, Cambridge, USA/National Bureau of Economic Research, and Center for Economic Policy Research, USA/Department of Economics, University of California at Los Angeles, Los Angeles, USA/Stern School of Business, New York University, New York, USA/National Bureau of Economic Research; and Center for Economic Policy Research, USA/Department of Economics, Northwestern University, Evanston, USA",1996/06,Political instability and economic growth,"This paper investigates the relationship between political instability and per capita GDP growth in a sample of 113 countries for the period 1950 through 1982. We define political instability as the propensity of a government collapse, and we estimate a model in which such a measure of political instability and economic growth are jointly determined. The main result of this paper is that in countries and time periods with a high propensity of government collapse, growth is significantly lower than otherwise. We also discuss the effects of different types of government changes on growth.",Springer,Economic Growth/Macroeconomics/Monetary Economics//Financial Economics/International Economics,OriginalPaper,https://link.springer.com//article/10.1007/BF00138862,    6920 ,   490 
0,Philip R. Lane/Aaron Tornell,"Department of Economics, Columbia University, New York, USA/Department of Economics, Harvard University, Cambridge, USA/NBER, USA",1996/06,"Power, growth, and the voracity effect","Why is it that resource-rich countries tend to have lower growth rates than resource-poor countries? And why is it that many countries that enjoy terms-of-trade windfalls end up with lower growth rates? To explain these puzzles, we extend the neoclassical growth model by replacing the representative agent with multiple powerful groups and by introducing a new concept, the voracity effect—a more than proportional increase in redistribution in response to an increase in the raw rate of return. We show that, in an economy with powerful groups and weak institutions, the voracity effect operates if the elasticity of intertemporal substitution is high enough. That is, there exists a negative relationship between the growth rate and the raw rate of return, which is positively related to the terms of trade. We provide some empirical evidence in support of the mechanism we propose.",Springer,Economic Growth/Macroeconomics/Monetary Economics//Financial Economics/International Economics,OriginalPaper,https://link.springer.com//article/10.1007/BF00138863,    923 ,   194 
0,Christopher Clague/Philip Keefer/Stephen Knack/Mancur Olson,"IRIS and University of Maryland, College Park, USA/The World Bank, Washington, DC, USA/IRIS and American University, School of Public Affairs, Washington, DC, USA/IRIS and University of Maryland, College Park, USA",1996/06,Property and contract rights in autocracies and democracies,"We present and test empirically a new theory of property and contract rights. Any incentive an autocrat has to respect such rights comes from his interest in future tax collections and national income and increases with his planning horizon. We find a compelling empirical relationship between property and contract rights and an autocrat's time in power. In lasting—but not in new—democracies, the same rule of law and individual rights that ensure continued free elections entail extensive property and contract rights. We show that the age of a democratic system is strongly correlated with property and contract rights.",Springer,Economic Growth/Macroeconomics/Monetary Economics//Financial Economics/International Economics,OriginalPaper,https://link.springer.com//article/10.1007/BF00138864,    961 ,   247 
0,Xavier X. Sala-I-Martin,"Department of Economics, Yale University, New Haven, USA/Universitat Pompeu Fabra, Barcelona, Spain",1996/06,A positive theory of social security,"In this paper I make two points. First, I argue that social security programs around the world link public pensions to retirement: people do not lose their pensions if they make a million dollars a year in the stock market, but they do confront marginal tax rates of up to 100 percent if they choose to work. Second, after arguing that most existing theories cannot explain this fact, I construct a positive theory that is consistent with it. The main idea is that pensions are a means to induce retirement—that is, to buy the elderly out of the labor force because aggregate output is higher if the elderly do not work. This is modeled through positive externalities in the average stock of human capital: because skills depreciate with age, the elderly have lower-than-average skill and, as a result, have a negative effect on the productivity of the young. When the difference between the skill level of the young and that of the old is large enough, aggregate output in an economy where the elderly do not work is higher. Retirement is desirable in this case, and social security transfers are the means by which such retirement is induced. The theory developed in this paper is also shown to be consistent with a number of other regularities documented in Section 1.",Springer,Economic Growth/Macroeconomics/Monetary Economics//Financial Economics/International Economics,OriginalPaper,https://link.springer.com//article/10.1007/BF00138865,    516 ,   61 
0,Costas Azariadis/Bruce D. Smith,"University of California at Los Angeles, Los Angeles, USA/University of Texas-Austin and Federal Reserve Bank of Minneapolis, Minneapolis, USA",1996/09,"Private information, money, and growth: Indeterminacy, fluctuations, and the Mundell-Tobin effect","We introduce an informational asymmetry into an otherwise standard monetary growth model and examine its implications for the determinacy of equilibrium, for endogenous economic volatility, and for the relationship between steady-state output and the rate of money growth. Some empirical evidence suggests that, for economies with low initial inflation rates, permanent increases in the money growth rate raise long-run output levels. This relationship is reversed for economies with high initial inflation rates. Our model predicts this pattern. Moreover, in economies with high enough rates of inflation, credit rationing emerges, monetary equilibria become indeterminate, and endogenous economic volatility arises.",Springer,Economic Growth/Macroeconomics/Monetary Economics//Financial Economics/International Economics,OriginalPaper,https://link.springer.com//article/10.1007/BF00141041,    268 ,   71 
0,Herschel I. Grossman/Minseong Kim,"Brown University, USA/University of Pittsburgh, Pittsburgh, USA",1996/09,Predation and accumulation,"This article incorporates the economic theory of predation into the theory of economic growth. The analytical framework is a general-equilibrium model of the interaction between two dynasties: a potential predator and its prey. We find that the rate of accumulation of capital and the security of property are positively related only for generations of the prey dynasty that tolerate predation. Generations of the prey dynasty that choose to deter predation, even though their property is perfectly secure, accumulate productive capital more slowly than the preceding generations that tolerated predation.",Springer,Economic Growth/Macroeconomics/Monetary Economics//Financial Economics/International Economics,OriginalPaper,https://link.springer.com//article/10.1007/BF00141042,    261 ,   61 
0,Daniel Cohen,"Ecole Normale Supérieure, CEPREMAP, and CEPR, USA",1996/09,Tests of the “convergence hypothesis”: Some further results,"The article presents new tests of the convergence hypothesis. It first analyzes the unconditional pattern of growth of human and physical capital (conventionally measured by an inventory method) and shows that these tests do support the hypothesis that domestic inputs of poor countries appear to be catching up with those of rich countries. On the other hand, when one analyzes the pattern of growth of physical capital and Solow residual, then one is led to reject the convergence theory. Building on this discrepancy, I demonstrate that the poor countries have failed to catch up with rich ones because the progress that they have achieved in educating their workers (which is evidenced in the convergence of domestic inputs) is not sufficient to compensate for their poor endowment in the knowledge on which the education of workers stands.",Springer,Economic Growth/Macroeconomics/Monetary Economics//Financial Economics/International Economics,OriginalPaper,https://link.springer.com//article/10.1007/BF00141043,    214 ,   23 
0,Francesco Caselli/Gerardo Esquivel/Fernando Lefort,"Harvard University, Harvard, USA/Harvard University, Harvard, USA/Harvard University, Harvard, USA",1996/09,Reopening the convergence debate: A new look at cross-country growth empirics,"There are two sources of inconsistency in existing cross-country empirical work on growth: correlated individual effects and endogenous explanatory variables. We estimate a variety of cross-country growth regressions using a generalized method of moments estimator that eliminates both problems. In one application, we find that per capita incomes converge to their steady-state levels at a rate of approximately 10 percent per year. This result stands in sharp contrast to the current consensus, which places the convergence rate at 2 percent. We discuss the theoretical implications of this finding. In another application, we perform a test of the Solow model. Again, contrary to prior reults, we reject both the standard and the augmented version of the model.",Springer,Economic Growth/Macroeconomics/Monetary Economics//Financial Economics/International Economics,OriginalPaper,https://link.springer.com//article/10.1007/BF00141044,    1706 ,   820 
0,Jong-Wha Lee,"Korea University and NBER, Korea",1996/09,Government interventions and productivity growth,"This article investigates the impact of government industrial policy and trade protection of the manufacturing sector in Korea. Empirical results are provided, using four-period panel data for the years 1963 through 1983, for thirty-eight Korean industries in which trade protection reduced growth rates of labor productivity and total factor productivity, while industrial policies, such as tax incentives and subsidized credit, were not correlated with total factor productivity growth in the promoted sectors. The evidence thus implies that less government intervention in trade is linked to higher productivity growth.",Springer,Economic Growth/Macroeconomics/Monetary Economics//Financial Economics/International Economics,OriginalPaper,https://link.springer.com//article/10.1007/BF00141045,    1041 ,   87 
0,Nancy L. Stokey,"University of Chicago, Chicago, USA",1996/12,"Free trade, factor returns, and factor accumulation","A model of development is studied in which physical capital and unskilled labor are good substitutes, and skilled labor is complementary to the resulting aggregate. Growth in a closed economy is compared with two open regimes. Inflows of physical capital only reduce the interest rate and raise both wage rates. The skilled wage rises more sharply, however, increasing the skill premium and accelerating human capital accumulation. Full integration with a larger and more developed neighbor also reduces the interest rate and raises both wage rates, but in this case the skill premium falls and human capital accumulation changes very little.",Springer,Economic Growth/Macroeconomics/Monetary Economics//Financial Economics/International Economics,OriginalPaper,https://link.springer.com//article/10.1007/BF00150196,    380 ,   59 
0,Costas Azariadis,"University of California, Los Angeles, USA",1996/12,The economics of poverty traps part one: Complete markets,"This paper lists theoretical reasons why neoclassical models of one-sector growth imply that nations with identical economic structures need not converge to the same steady state or balanced growth path, and outlines the empirical significance and policy implications of conditional nonconvergence. We survey poverty traps in both convex and nonconvex economies with complete market structures. Among the potential causes of traps are subsistence consumption; distorted international trade in intermediate inputs; demographic transitions when fertility is endogenous; technological complementarities in the production of consumption goods, financial intermediation services, manufactures, or human capital; coordination failures among voters; various restrictions on borrowing; indivisibilities in human capital formation or child rearing; and monopolistic competition in product or factor markets.",Springer,Economic Growth/Macroeconomics/Monetary Economics//Financial Economics/International Economics,OriginalPaper,https://link.springer.com//article/10.1007/BF00150197,    807 ,   123 
0,Graziella Bertocchi/Yong Wang,"Universita' di Modena and CEPR, Italy/Virginia Polytechnic Institute and State University, USA",1996/12,"Imperfect information, Bayesian learning, and capital accumulation","This paper examines the consequences of informational imperfections for economic growth in an overlapping generations model in which agents learn the technological parameters in a Bayesian fashion. Under mild sufficient conditions, beliefs converge to the true value of the technological parameters. Nevertheless, even short-lived informational imperfections could have lasting effects, as they alter the long-run equilibrium levels of the capital stock. Therefore, learning dynamics may explain some of the observed differences in the performance of countries with otherwise similar economic characteristics.",Springer,Economic Growth/Macroeconomics/Monetary Economics//Financial Economics/International Economics,OriginalPaper,https://link.springer.com//article/10.1007/BF00150198,    96 ,   1 
0,Chien-Fu Chou/Gabriel Talmain,"National Taiwan University, Taiwan/University of York, Yorkshire, UK",1996/12,Redistribution and growth: Pareto improvements,"This paper analyzes the relationship between income distribution and economic growth. It introduces heterogeneous households who have preferences for leisure into Grossman and Helpman's model of endogenous growth (in which income distribution has no effect on economic growth). Wealth distribution affects the endogenous rate of growth as the labor supply of each individual responds inversely to his permanent income. When the labor Engel curve is concave (convex), unequal wealth distribution decreases (increases) the rate of growth. Pareto-improving-growth-enhancing wealth redistributions are characterized.",Springer,Economic Growth/Macroeconomics/Monetary Economics//Financial Economics/International Economics,OriginalPaper,https://link.springer.com//article/10.1007/BF00150199,    188 ,   15 
0,Robert J. Barro/Xavier Sala-i-Martin,"Harvard University, USA/Columbia University, USA/Universitat Pompeu Fabra, Spain",1997/03,"Technological Diffusion, Convergence, and Growth","We construct a model that combines elements of endogenousgrowth with the convergence implications of the neoclassicalgrowth model. In the long run, the world growth rate is drivenby discoveries in the technologically leading economies. Followersconverge toward the leaders because copying is cheaper than innovationover some range. A tendency for copying costs to increase reducesfollowers‘ growth rates and thereby generates a pattern of conditionalconvergence. We discuss how countries are selected to be technologicalleaders, and we assess welfare implications. Poorly defined intellectualproperty rights imply that leaders have insufficient incentiveto invent and followers have excessive incentive to copy.",Springer,Economic Growth/Macroeconomics/Monetary Economics//Financial Economics/International Economics,OriginalPaper,https://link.springer.com//article/10.1023/A%3A1009746629269,    1448 ,   357 
