,citation_author,citation_author_institution,citation_publication_date,citation_title,dc.description,dc.publisher,dc.subject,dc.type,url,accesses,citations
0,Anandi Mani,"Department of Economics, Vanderbilt University, Nashville/Economic Growth Center, Yale University, New Haven",2001/06,Income Distribution and the Demand Constraint,"This paper argues thatthe interaction between inequality and the demand patterns forgoods is a potential source of persistent inequality. Incomedistribution, in the presence of non-homothetic preferences,affects the demand for goods and, due to differences in factorintensities across sectors, it alters the return to factors ofproduction and the initial distribution of income. Low inequalityleads to high demand for medium skilled intensive goods, providinga bridge over which low skill dynasties may transition to thehigh-skilled sector in the long run. Under high inequality however,the initial lack of demand for medium skilled labor breachesthis bridge from poverty to prosperity and inequality persists.",Springer,Economic Growth/Macroeconomics/Monetary Economics//Financial Economics/International Economics,OriginalPaper,https://link.springer.com//article/10.1023/A%3A1011326523470,    260 ,   15 
0,William Easterly,"Washington,DC",2001/06,The Lost Decades: Developing Countries' Stagnation in Spite of Policy Reform 1980–1998,"I document in this paper a puzzle thathas not received previous attention in the literature. In 1980–98,median per capita income growth in developing countries was 0.0percent, as compared to 2.5 percent in 1960–79. Yet I documentin this paper that variables that are standard in growth regressions—policieslike financial depth and real overvaluation, and initial conditionslike health, education, fertility, and infrastructure generallyimproved from 1960–79 to 1980–98. Developing countrygrowth should have increased instead of decreased according tothe standard growth regression determinants of growth. The stagnationseems to represent a disappointing outcome to the movement towardsthe ``Washington Consensus'' by developing countries. I speculatethat worldwide factors like the increase in world interest rates,the increased debt burden of developing countries, the growthslowdown in the industrial world, and skill-biased technicalchange may have contributed to the developing countries' stagnation,although I am not able to establish decisive evidence for thesehypotheses. I also document that many growth regressions aremis-specified in a way similar to the Jones (1995) critique thata stationary variable (growth) is being regressed on non-stationaryvariables like policies and initial conditions. It may be thatthe 1960–1979 period was the unusual period for LDC growth,and the 1980–98 stagnation of poor countries representsa return to the historical pattern of divergence between richand poor countries.",Springer,Economic Growth/Macroeconomics/Monetary Economics//Financial Economics/International Economics,OriginalPaper,https://link.springer.com//article/10.1023/A%3A1011378507540,    2543 ,   216 
0,William A. Masters/Margaret S. McMillan,"Department of Agricultural Economics, Purdue University, USA/Department of Economics, Tufts University, USA",2001/09,Climate and Scale in Economic Growth,"This paper introduces new data on climatic conditions to empirical tests of growth theories. We find that, since 1960, temperate countries have converged towards high levels of income while tropical nations have converged towards various income levels associated with economic scale and the extent of the market. These results hold for a wide range of tests. A plausible explanation is that temperate regions' growth was assisted by their climate, perhaps historically for their transition out of agriculture into sectors whose productivity converges across countries, while tropical countries' growth is relatively more dependent on gains from specialization and trade.",Springer,Economic Growth/Macroeconomics/Monetary Economics//Financial Economics/International Economics,OriginalPaper,https://link.springer.com//article/10.1023/A%3A1011398431524,    944 ,   146 
0,Carl-Johan Dalgaard/Claus Thustrup Kreiner,"University of Copenhagen, Denmark/EPRU, and CESifo, University of Copenhagen, Denmark",2001/09,Is Declining Productivity Inevitable?,"Fertility has been declining on all continents for the last couple of decades and this development is expected to continue in the future. Prevailing innovation-based growth theories imply, as a consequence of scale effects from the size of population, that such demographic changes will lead to a major slowdown in productivity growth. In this paper we challenge this pessimistic view of the future. By allowing for endogenous human capital in a basic R&amp;D driven growth model we develop a theory of scale-invariant endogenous growth according to which population growth is neither necessary nor conductive for economic growth.",Springer,Economic Growth/Macroeconomics/Monetary Economics//Financial Economics/International Economics,OriginalPaper,https://link.springer.com//article/10.1023/A%3A1011343715594,    265 ,   54 
0,Etsuro Shioji,"Department of Economics, Yokohama National University, Hodogaya-ku, Yokohama, Japan",2001/09,Public Capital and Economic Growth: A Convergence Approach,"This paper estimates dynamic effects of public capital on output per capita. Based on an open economy growth model, I derive a version of the income convergence equation augmented with public capital. This equation is estimated using panel data of United States and Japanese regions. Sensible results are obtained when public capital is disaggregated into components. In both countries, the infrastructure component of public capital turns out to have significantly positive effects. The implied elasticity of output with respect to infrastructure is somewhere around 0.1 to 0.15. This suggests a modest contribution of infrastructure to postwar growth of the two countries.",Springer,Economic Growth/Macroeconomics/Monetary Economics//Financial Economics/International Economics,OriginalPaper,https://link.springer.com//article/10.1023/A%3A1011395732433,    981 ,   77 
0,Pantelis Kalaitzidakis/Theofanis P. Mamuneas/Andreas Savvides/Thanasis Stengos,"University of Crete, Rethimno, Greece/University of Cyprus, Nicosia, Cyprus/University of Leicester, Leicester, UK/University of Cyprus, Nicosia, Cyprus/Oklahoma State University, Stillwater, USA/University of Guelph, Guelph, Canada",2001/09,Measures of Human Capital and Nonlinearities in Economic Growth,In this paper we study the relationship between human capital accumulation and economic growth using various measures of human capital frequently employed by researchers. We use semiparametric estimation techniques to uncover any nonlinearities that may exist. Using mean years of schooling measures of human capital we find a nonlinear effect on economic growth. There seem to be important differences in the growth effect of educational attainment by gender and level of education. Enrollment rates do not yield a nonlinear effect.,Springer,Economic Growth/Macroeconomics/Monetary Economics//Financial Economics/International Economics,OriginalPaper,https://link.springer.com//article/10.1023/A%3A1011347816503,    1001 ,   96 
0,Peter Thompson,"Department of Economics, 204 McElhinney Hall, University of Houston, Houston",2001/12,The Microeconomics of an R&amp;D-Based Model of Endogenous Growth,"This paper explores the microeconomic structure underlying a class of endogenous growth models in which product differentiation and stochastic quality growth coexist. The general equilibrium model generates a stationary stochastic equilibrium in which a nondegenerate ergodic distribution of firm size depends systematically on parameters of the model. Features of the model necessary for stable endogenous aggregate growth are explored, and predictions of the model are compared with microeconometric evidence on R&amp;D intensity, firm growth, and concentration.",Springer,Economic Growth/Macroeconomics/Monetary Economics//Financial Economics/International Economics,OriginalPaper,https://link.springer.com//article/10.1023/A%3A1012761811439,    370 ,   30 
0,Eric D. Gould/Omer Moav/Bruce A. Weinberg,"Department of Economics, Hebrew University, Jerusalem, Israel/Department of Economics, Hebrew University, Jerusalem, Israel/Department of Economics, Ohio State University, Columbus",2001/12,"Precautionary Demand for Education, Inequality, and Technological Progress","This paper offers an explanation for the evolution of wage inequality within and between industries and education groups over the past several decades. The model is based on the disproportionate depreciation of technology-specific skills versus general skills due to technological progress, which occurs randomly across sectors. Consistent with empirical evidence, the model predicts that increasing randomness is the primary source of inequality growth within uneducated workers, whereas inequality growth within educated workers is determined more by changes in the composition and return to ability. Increasing randomness generates a “precautionary” demand for education, which we show empirically to be significant.",Springer,Economic Growth/Macroeconomics/Monetary Economics//Financial Economics/International Economics,OriginalPaper,https://link.springer.com//article/10.1023/A%3A1012782212348,    549 ,   62 
0,William Easterly,"World Bank, Denmark",2001/12,The Middle Class Consensus and Economic Development,"A middle class consensus is defined as a high share of income for the middle class and a low degree of ethnic divisons. The paper links a middle class consensus to resource endowments, along the lines of the provocative thesis of Engerman and Sokoloff (1997 and 2000). This paper exploits this association using tropical resource endowments as instruments for inequality. A higher share of income for the middle class and lower ethnic divisions are associated with higher income and higher growth, as well as with more education, better health, better infrastructure, better economic policies, less political instability, less civil war and ethnic minorities at risk, more social “modernization” and more democracy.",Springer,Economic Growth/Macroeconomics/Monetary Economics//Financial Economics/International Economics,OriginalPaper,https://link.springer.com//article/10.1023/A%3A1012786330095,    2803 ,   306 
0,Tomas Kögel/Alexia Prskawetz,"Max Planck Institute for Demographic Research, Rostock, Germany/Max Planck Institute for Demographic Research, Rostock, Germany",2001/12,Agricultural Productivity Growth and Escape from the Malthusian Trap,"Industrialization allowed the industrialized world of today to escape from the Malthusian regime characterized by low economic and population growth and to enter the post-Malthusian regime of high economic and population growth. To explain the transition between these regimes, we construct a growth model with two consumption goods (an agricultural and a manufacturing good), endogenous fertility, and endogenous technological progress in the manufacturing sector. We show that with an exogenous increase in the growth of agricultural productivity our model is able to replicate stylized facts of the British industrial revolution. The paper concludes by illustrating that our proposed model framework can be extended to include the demographic transition, i.e., a regime in which economic growth is associated with falling fertility.",Springer,Economic Growth/Macroeconomics/Monetary Economics//Financial Economics/International Economics,OriginalPaper,https://link.springer.com//article/10.1023/A%3A1012742531003,    1151 ,   91 
0,Wolfgang Keller,"Department of Economics, University of Texas, Austin, USA",2002/03,Trade and the Transmission of Technology,"This paper integrates earlier studies on the link of productivity and research and development (R&amp;D) in different industries of a closed economy with the more recent emphasis on R&amp;D-driven growth and international trade in open economies. In this framework, technology in the form of product designs is transmitted to other industries, both domestically as well as internationally, through trade in differentiated intermediate goods. I present empirical results based on a new industry-level data set that covers more than 65 percent of the world’s manufacturing output and most of the world’s R&amp;D expenditures between 1970 and 1991. The analysis considers productivity effects from R&amp;D in the domestic industry itself, from R&amp;D in other domestic industries, as well as in the same and other foreign industries. I estimate strong productivity effects both from own R&amp;D spending and R&amp;D conducted elsewhere. The contribution of R&amp;D in the industry itself is about 50 percent in this sample. Domestic R&amp;D in other industries is the source of 30 percent of the productivity increases, and the remaining 20 percent are due to R&amp;D expenditures in foreign industries.",Springer,Economic Growth/Macroeconomics/Monetary Economics//Financial Economics/International Economics,OriginalPaper,https://link.springer.com//article/10.1023/A%3A1013461025733,    875 ,   194 
0,Ugo Panizza,"Research Department, Inter-American Development Bank, Washington DC, USA",2002/03,Income Inequality and Economic Growth: Evidence from American Data,"While most cross-country studies find a negative relationship between income inequality and economic growth, studies that use panel data suggest the presence of a positive relationship between inequality and growth. This paper uses a cross-state panel for the United States to assess the relationship between inequality and growth. Using both standard fixed effects and GMM estimations, this paper does not find evidence of a positive relationship between inequality and growth but finds some evidence in support of a negative relationship between inequality and growth. The paper, however, shows that the relationship between inequality and growth is not robust and that small differences in the method used to measure inequality can result in large differences in the estimated relationship between inequality and growth.",Springer,Economic Growth/Macroeconomics/Monetary Economics//Financial Economics/International Economics,OriginalPaper,https://link.springer.com//article/10.1023/A%3A1013414509803,    2834 ,   101 
0,Michael Bleaney/Akira Nishiyama,"School of Economics, University of Nottingham, Nottingham, UK/School of Economics, University of Nottingham, Nottingham, UK",2002/03,Explaining Growth: A Contest Between Models,"Recent contributions to the empirical growth literature show no tendency to convergence in specification, as researchers seek to identify new variables that can account for significant regional effects in earlier work. We conduct non-nested tests between the models of Barro (1997), Easterly and Levine (1997) and Sachs and Warner (1997). The data strongly prefer an encompassing model, but fail to reject any of the candidate models, implying that each model represents a partial truth. We identify a model that includes most (but not all) of the regressors in the candidate models and is robust to the inclusion of regional dummies.",Springer,Economic Growth/Macroeconomics/Monetary Economics//Financial Economics/International Economics,OriginalPaper,https://link.springer.com//article/10.1023/A%3A1013466526642,    415 ,   83 
0,Athanasios Vamvakidis,"International Monetary Fund, Washington DC",2002/03,How Robust is the Growth-Openness Connection? Historical Evidence,"Previous literature has established a positive correlation between openness to international trade and GDP per capita growth for developed and developing economies in recent decades. However, looking at historical evidence from 1870 to the present, this paper finds no support for a positive growth-openness connection before 1970. In fact, the correlation is negative for the period 1920–1940. Cross-country growth regressions estimated for the period 1920–1990 suggest that the positive correlation between openness and growth is only a recent phenomenon. The paper provides useful conclusions regarding the robustness not only of the openness variables but also of other growth determinants.",Springer,Economic Growth/Macroeconomics/Monetary Economics//Financial Economics/International Economics,OriginalPaper,https://link.springer.com//article/10.1023/A%3A1013418610712,    1023 ,   117 
0,Huw Lloyd-Ellis/Joanne Roberts,"Department of Economics, Queen’s University, Kingston, Canada/Department of Economics, University of Toronto, Toronto, Canada",2002/06,Twin Engines of Growth: Skills and Technology as Equal Partners in Balanced Growth,"We develop an endogenous growth model in which skill acquisition by households and innovation by firms make distinct contributions to productivity growth. Nevertheless, the incentives faced by firms and households are inextricably linked because skills are required to implement new technologies. Skills and technologies are dynamic complements but, because their production complementarity is inherently bounded, they are “equal partners” in driving growth: neither can generate sustained growth alone. Our model has important implications for the effectiveness of alternative growth-promoting policies, for interpretating the empirical relationship between growth and schooling, and the relationship between growth and intergenerational wage dispersion.",Springer,Economic Growth/Macroeconomics/Monetary Economics//Financial Economics/International Economics,OriginalPaper,https://link.springer.com//article/10.1023/A%3A1015633528122,    274 ,   26 
0,Arthur Fishman/Avi Simhon,"Department of Economics, Bar Ilan University, Israel/Hebrew University of Jerusalem, Israel",2002/06,"The Division of Labor, Inequality and Growth","We present a model that links the division of labor and economic growth with the division of wealth in society. When capital market imperfections restrict the access of poor households to capital, the division of wealth affects individual incentives to invest in specialization. In turn, the division of labor determines the dynamics of the wealth distribution. A highly concentrated distribution of wealth leads to a low degree of specialization, low productivity, and low wages. In that case workers are unable to accumulate enough wealth to invest in specialization. Hence, in a highly unequal society, there is a vicious cycle in which the degree of specialization, productivity and wages stay low, wealth and income inequality stays high and the economy stagnates. By contrast, greater equality increases investment in specialization and leads to a greater division of labor and higher long run development.",Springer,Economic Growth/Macroeconomics/Monetary Economics//Financial Economics/International Economics,OriginalPaper,https://link.springer.com//article/10.1023/A%3A1015672012193,    578 ,   29 
0,Richard Nahuis/Sjak Smulders*,"CPB Netherlands Bureau for Economic Policy Analysis and Nijmegen University, The Hague, The Netherlands/Department of Economics and CentER, Tilburg University, Tilburg, The Netherlands",2002/06,"The Skill Premium, Technological Change and Appropriability","This paper demonstrates that an increase in the relative supply of educated workers generates a structural change in the production structure towards a knowledge-intensive production process. This structural shift may ultimately lead to an increase in the return to educated labor despite the increase in their supply. The paper argues that the steady increase in the supply of educated workers that most Western economies have experienced in recent decades may be viewed as the driving force behind the observed pattern of wage inequality. In particular, the paper demonstrates that if firms can appropriate a sufficient share of the intertemporal return from knowledge generating activities of their labor force, a gradual increase in the supply of skilled workers would generate only a temporary reduction in the skill premium followed by a permanent increase in the return to skill.",Springer,Economic Growth/Macroeconomics/Monetary Economics//Financial Economics/International Economics,OriginalPaper,https://link.springer.com//article/10.1023/A%3A1015624129031,    159 ,   7 
0,Timothy G. Conley/Ethan Ligon,"University of Chicago, USA/University of California, Berkeley, USA",2002/06,Economic Distance and Cross-Country Spillovers,"Rates of long-run economic growth are not independent across countries. To account for this dependence we decompose the spatial covariance function of growth rates into a function of each country’s own observable characteristics, its unobservable characteristics, and cross-country spillovers. We use original data on economic distance to structure observed variation in countries’ long term growth rates. We use this structure to estimate the magnitude of economic interdependence among nations, and to give a nonparametric characterization of the relationship between economic distance and the magnitude of cross-country spillovers. These spillovers turn out to be quite important, accounting for more of the spatial covariance in growth rates than unobservable variables, and by some measures rivalling the importance of the country’s own observable characteristics.",Springer,Economic Growth/Macroeconomics/Monetary Economics//Financial Economics/International Economics,OriginalPaper,https://link.springer.com//article/10.1023/A%3A1015676113101,    1045 ,   103 
0,David Dollar/Aart Kraay,"Development Research Group, The World Bank, USA/Development Research Group, The World Bank, USA",2002/09,Growth is Good for the Poor,"Average incomes of the poorest quintile rise proportionately with average incomes in a sample of 92 countries spanning the last four decades. This is because the share of income of the poorest quintile does not vary systematically with average income. It also does not vary with many of the policies and institutions that explain growth rates of average incomes, nor does it vary with measures of policies intended to benefit the poorest in society. This evidence emphasizes the importance of economic growth for poverty reduction.",Springer,Economic Growth/Macroeconomics/Monetary Economics//Financial Economics/International Economics,OriginalPaper,https://link.springer.com//article/10.1023/A%3A1020139631000,    10k ,   875 
0,Michael Kremer/Daniel L. Chen,"Department of Economics, Harvard University, Littauer Center, Cambridge, USA/Brookings Institution and National Bureau of Economic Research, USA/Brookings Institution and National Bureau of Economic Research, USA",2002/09,Income Distribution Dynamics with Endogenous Fertility,"Developing countries with highly unequal income distributions, such as Brazil or South Africa, face an uphill battle in reducing inequality. Educated workers in these countries have a much lower birthrate than uneducated workers. Assuming children of educated workers are more likely to become educated, this fertility differential increases the proportion of unskilled workers, reducing their wages, and thus their opportunity cost of having children, creating a vicious cycle. A model incorporating this effect generates multiple steady-state levels of inequality, suggesting that in some circumstances, temporarily increasing access to educational opportunities could permanently reduce inequality. Empirical evidence suggests that the fertility differential between the educated and uneducated is greater in less equal countries, consistent with the model.",Springer,Economic Growth/Macroeconomics/Monetary Economics//Financial Economics/International Economics,OriginalPaper,https://link.springer.com//article/10.1023/A%3A1020154031908,    780 ,   54 
0,Rodrigue Mendez,"EUREQUA, U.M.R 8594 C.N.R.S., Maison des Sciences Economiques, Paris Cedex 13, France",2002/09,Creative Destruction and the Rise of Inequality,"Common wisdom interprets the rise in inequality of the last two decades as the result of a skill-biased labor demand shift. This explanation does not account for two important observations: (i) within-group inequality has also markedly risen, and (ii) the rise of inequality has been accompanied by a rise of the volatility of earnings. This paper argues that a dual labor market structure, where some workers are paid efficiency-wages can account for the empirical regularities, in the absence of skilled biased technological change. The analysis demonstrates that an unbiased innovation, as well as North–South trade, can contribute to the efficiency wage premium, and thus to wage inequality, by increasing labor turnover.",Springer,Economic Growth/Macroeconomics/Monetary Economics//Financial Economics/International Economics,OriginalPaper,https://link.springer.com//article/10.1023/A%3A1020158115979,    271 ,   8 
